"Status","Start Time","Stop Time","Duration in ms","Parent Suite","Suite","Sub Suite","Test Class","Test Method","Name","Description"
"passed","Mon Oct 09 04:24:20 GMT 2023","Mon Oct 09 04:24:26 GMT 2023","5942","","","Theia app","","","should show main content panel",""
"passed","Mon Oct 09 04:24:41 GMT 2023","Mon Oct 09 04:24:42 GMT 2023","1020","","","Theia Text Editor","","","should be dirty after changing the file contents and clean after save",""
"passed","Mon Oct 09 04:24:26 GMT 2023","Mon Oct 09 04:24:26 GMT 2023","95","","","Theia app","","","should have menu bar items",""
"passed","Mon Oct 09 04:24:26 GMT 2023","Mon Oct 09 04:24:26 GMT 2023","39","","","Theia app","","","should show status bar",""
"passed","Mon Oct 09 04:24:26 GMT 2023","Mon Oct 09 04:24:41 GMT 2023","14588","","","Theia Text Editor","","","should be visible and active after opening ""sample.txt""",""
