"Status","Start Time","Stop Time","Duration in ms","Parent Suite","Suite","Sub Suite","Test Class","Test Method","Name","Description"
"passed","Fri Jan 19 04:09:50 GMT 2024","Fri Jan 19 04:09:50 GMT 2024","16","","","Theia app","","","should show status bar",""
"passed","Fri Jan 19 04:10:02 GMT 2024","Fri Jan 19 04:10:03 GMT 2024","881","","","Theia Text Editor","","","should be dirty after changing the file contents and clean after save",""
"passed","Fri Jan 19 04:09:50 GMT 2024","Fri Jan 19 04:10:02 GMT 2024","11874","","","Theia Text Editor","","","should be visible and active after opening ""sample.txt""",""
"passed","Fri Jan 19 04:09:44 GMT 2024","Fri Jan 19 04:09:50 GMT 2024","5540","","","Theia app","","","should show main content panel",""
"passed","Fri Jan 19 04:09:50 GMT 2024","Fri Jan 19 04:09:50 GMT 2024","38","","","Theia app","","","should have menu bar items",""
