"Status","Start Time","Stop Time","Duration in ms","Parent Suite","Suite","Sub Suite","Test Class","Test Method","Name","Description"
"passed","Tue Jan 09 04:09:13 GMT 2024","Tue Jan 09 04:09:25 GMT 2024","11510","","","Theia Text Editor","","","should be visible and active after opening ""sample.txt""",""
"passed","Tue Jan 09 04:09:09 GMT 2024","Tue Jan 09 04:09:13 GMT 2024","4134","","","Theia app","","","should show main content panel",""
"passed","Tue Jan 09 04:09:13 GMT 2024","Tue Jan 09 04:09:13 GMT 2024","39","","","Theia app","","","should have menu bar items",""
"passed","Tue Jan 09 04:09:25 GMT 2024","Tue Jan 09 04:09:26 GMT 2024","768","","","Theia Text Editor","","","should be dirty after changing the file contents and clean after save",""
"passed","Tue Jan 09 04:09:13 GMT 2024","Tue Jan 09 04:09:13 GMT 2024","21","","","Theia app","","","should show status bar",""
