"Status","Start Time","Stop Time","Duration in ms","Parent Suite","Suite","Sub Suite","Test Class","Test Method","Name","Description"
"passed","Wed Mar 20 04:09:23 GMT 2024","Wed Mar 20 04:09:36 GMT 2024","12761","","","Theia Text Editor","","","should be visible and active after opening ""sample.txt""",""
"passed","Wed Mar 20 04:09:36 GMT 2024","Wed Mar 20 04:09:36 GMT 2024","796","","","Theia Text Editor","","","should be dirty after changing the file contents and clean after save",""
"passed","Wed Mar 20 04:09:18 GMT 2024","Wed Mar 20 04:09:23 GMT 2024","4244","","","Theia app","","","should show main content panel",""
"passed","Wed Mar 20 04:09:23 GMT 2024","Wed Mar 20 04:09:23 GMT 2024","45","","","Theia app","","","should have menu bar items",""
"passed","Wed Mar 20 04:09:23 GMT 2024","Wed Mar 20 04:09:23 GMT 2024","22","","","Theia app","","","should show status bar",""
